link; label;Unnamed: 2;metadata
https://www.wildberries.ru/catalog/81728390/detail.aspx?utm_campaign=lorealru&utm_source=cpd_oap_elsevehyaluron_yandexdisplay&utm_medium=partner&utm_content=prog_display&utm_term=main_aw;Парфюмерия и косметика;;Покупателям,Подтвердите свой возраст,Партнерам,Компания,Мы в соцсетях,Приложение Wildberries,Наши проекты
https://www.letu.ru/product/rochas-mademoiselle-rochas/53700063;Парфюмерия и косметика;;L'Etoile,
https://perviyonline.ru/;Парфюмерия и косметика;;ПЕРВЫЙ.онлайн - парфюм, косметика, аксессуары, уходовые средства, одежда и обувь,СКИДКИ ДО -40%,Уют в деталях: диффузоры для дома,Программа лояльности,МАСКИ 1/1 ОТ ПЕРВОГО,Бесплатная доставка,PIERRE GUILLAUME PARIS,Осенний уход с ANGIOPHARM
http://www.parfumelita.ru/;Парфюмерия и косметика;;Интернет магазин. Парфюмерия. Косметика.,
https://perfume-cosmetics.ru/;Парфюмерия и косметика;;«Парфюм Косметик» - ведущий поставщик косметики и парфюмерии масс-маркет,О компании,Нам доверяют
https://www.filion.ru/shops/parfjumerija-i-kosmetika/;Парфюмерия и косметика;;Парфюмерия и косметика в Москве: магазины парфюмерии и косметики в большом развлекательном центре ФИЛИОН,Парфюмерия и косметика
https://msk.parfumica.ru/;Парфюмерия и косметика;;Купить косметику и парфюмерию в интернет магазине в Москве,Интернет-магазин парфюмерии и косметикиИдеи подарков
https://www.ozon.ru/category/kosmetika-i-parfyumeriya/;Парфюмерия и косметика;;
https://www.apple.com/ru/macbook-air/;Компьютерная техника;;MacBook Air – Apple (RU),MacBook AirНижний колонтитул Apple,Дисплей Retina,Дополненная реальность,Возможности подключения,Камера и микрофоны,С новой силой.,Аксессуары,Непрерывность,Magic KeyboardСамый большой выбор приложений,Камера FaceTime HD,Безопасность,Apple Store,Ценности Apple,Графический процессор,Высокая плотность пикселей,MacBook Air умеет хранить секреты.,macOS Monterey,Touch ID,Выбирайте и покупайте,Высокая скорость и быстрый отклик,Wi‑Fi 6,О компании Apple,8‑ядерный графический процессор Большая игра.,Объединённая память,Эффективный теплообмен,Технология True Tone,Широкий цветовой охват (P3),Посмотрите в дополненной реальности, как будет выглядеть MacBook Air на вашем рабочем месте.,Для образования,Машинное обучение,Цветовая палитра ещё шире.,Целый день без подзарядки,Центральный процессор,Механизм «ножницы»,Для бизнеса,Учётная запись,SSD‑накопитель,Трекпад Force Touch,Сервисы,Порты Thunderbolt/USB 4,Система из трёх микрофонов
https://market.yandex.ru/product--13-6-noutbuk-apple-macbook-air-13-2022-2560x1664-apple-m2-ram-8-gb-lpddr5-ssd-256-gb-apple-graphics-8-core-macos-polunochnyi/1766132334?sku=101893804745&utm_term=91013%7C101893804745&clid=1601&utm_source_service=web&utm_source=yandex&utm_medium=search&utm_campaign=ymp_offer_promo_april2023_best10_bko_dyb_search&utm_content=cid%3A86353695%7Cgid%3A5175045367%7Caid%3A13921844313%7Cph%3A3805533%7Cpt%3Apremium%7Cpn%3A4%7Csrc%3Anone%7Cst%3Asearch%7Crid%3A3805533%7Ccgcid%3A20729119&adjust_t=fs3pybh&adjust_ya_click_id=15522145997889994751&yclid=15522145997889994751&src_pof=1648&baobab_event_id=ln6f8tfj1&wprid=1696101833143419-6591508731518024951-balancer-l7leveler-kubr-yp-sas-66-BAL-9549&icookie=d3ihxhZyI3N%2BVx24tsoZB5kK8lfkWDo6fJEikinOq8gF0orlRtSfIoAkTZw7Ny%2BCNkXzQFuqXfw9r0u92OZrM66OFO0%3D;Компьютерная техника;;"Яндекс Маркет,13.6"" Ноутбук Apple MacBook Air 13 2022 2560x1664, Apple M2, RAM 8 ГБ, LPDDR5, SSD 256 ГБ, Apple graphics 8-core, macOS, полуночныйВы смотрели,Полезные ссылки,Часто ищут,Перейти к содержанию (Alt + 0),Где купить,Самое важное,Товар у продавца,Описание,Товар на Маркете,Еще может подойти13.3"" Ноутбук Apple MacBook Air M1 MGND3LL/A, Apple M1 (3.2 ГГц), RAM 8 ГБ, SSD 256 ГБ, Apple M1, macOS, A2337 (MGND3LL/A), Gold, Золотой,13.3"" Ноутбук Apple MacBook Air M1 MGN63LL/A, Apple M1 (3.2 ГГц), RAM 8 ГБ, SSD 256 ГБ, Apple M1, macOS, (MGN63LL/A), Space Gray, Серый,15.3"" Ноутбук Apple MacBook Air 15 2023 Apple M2, RAM 8 ГБ, SSD 512 ГБ, GPU 10, macOS, MQKT3RU/A, silver, русская раскладка,16.1"" Ноутбук HONOR MagicBook 16 1920x1080, AMD Ryzen 5 5600H 3.3 ГГц, RAM 16 ГБ, DDR4, SSD 512 ГБ, AMD Radeon Graphics, без ОС, HYM-W56, серебристый,15.6"" Ноутбук ASUS TUF Gaming A15 FA506IHR-HN019 1920x1080, AMD Ryzen 5 4600H 3 ГГц, RAM 8 ГБ, DDR4, SSD 512 ГБ, NVIDIA GeForce GTX 1650, без ОС, 90NR07G7-M003B0, черный,Ноутбук Apple MacBook Air (M1, 2020) 8 ГБ, 256 ГБ SSD, серебристый, MGN93,13.6"" Ноутбук Apple MacBook Air 13 2022 2560x1664, Apple M2, RAM 8 ГБ, SSD 256 ГБ, macOS, MLY13, сияющая звезда, Русская клавиатура(Гравировка),Продавцам,15.6"" Ноутбук HUAWEI MateBook D 15 1920x1280, Intel Core i3 1115G4 3 ГГц, RAM 8 ГБ, DDR4, SSD 256 ГБ, Intel UHD Graphics, Windows 11 Home, 53013PLV, космический серый,16.2"" Ноутбук Apple Macbook Pro Late 2021 3456×2234, Apple M1 Pro, RAM 16 ГБ, DDR, SSD 1 ТБ, Apple graphics 16-core, macOS, серый космос,Коротко о товаре,Характеристики,16"" Ноутбук Lenovo Legion 5 Pro Gen 6 16ACH6H 2560x1600, AMD Ryzen 7 5800H 3.2 ГГц, RAM 16 ГБ, DDR4, SSD 1 ТБ, NVIDIA GeForce RTX 3070, без ОС, 82JQ010DRK, Storm Grey,Ноутбук APPLE MacBook Air 13""/2020/ M1 chip 7-core GPU/8Gb/256GB SSD, MGND3PA/A, Gold,Ноутбук Apple MacBook Air 15 M2 8/256Gb Midnight (MQKW3),13.3"" Ноутбук Apple MacBook Pro 13 Late 2020 2560x1600, Apple M1 3.2 ГГц, RAM 8 ГБ, DDR4, SSD 256 ГБ, Apple graphics 8-core, macOS, MYD82D/A, серый космос, английская раскладка,15.6"" Ноутбук MSI GF6311UD-223XRU 1920x1080, Intel Core i5 11400H 2.7 ГГц, RAM 8 ГБ, DDR4, SSD 512 ГБ, NVIDIA GeForce RTX 3050 Ti, DOS, 9S7-16R612-223, черный,Сотрудничество,Ноутбук Huawei MateBook D NbD-WDI9 53013PLU (Intel Core i3-1115G4 3GHz/8192Mb/256Gb SSD/Intel HD Graphics/Wi-Fi/Cam/14/1920x1080/Windows 11 64-bit),Apple MacBook Pro 14"" (M2 Pro 10C CPU, 16C GPU, 2023) 16 ГБ, 512 ГБ SSD, серебристый, MPHH3, Российская клавиатура (Гравировка),Ноутбук Apple MacBook Air 15.3"" (M2 8C CPU/10C GPU 2023) 8 ГБ 512 ГБ SSD (MQKV3) Сияющая звезда/Русская Раскладка,15.3"" Ноутбук Apple MacBook Air 15 2023 M2, RAM 8 ГБ, SSD 256 ГБ, GPU 10, MQKU3RU/A, starlight/русская раскладка,Ноутбук Xiaomi RedmiBook Pro 15 3200x2000, AMD Ryzen 5 6600H 3.3 ГГц, RAM 16 ГБ, SSD 512 ГБ, AMD Radeon 660M, Windows 11 Home, JYU4474CN, серый,Apple MacBook Air 13"" (M2, 8C CPU/8C GPU, 2022), 8 ГБ, 256 ГБ SSD, A2681 (MLXW3) Серый космос,16.2 Ноутбук Apple MacBook Pro 16 2023 3456x2234 Aplle M2 Pro, RAM 16 ГБ, SSD 512 ГБ, Apple Graphics 19-core/ macOS, SILVER, Русская раскладка,13.3"" Ноутбук Apple MacBook Pro 13 Late 2020 2560x1600, Apple M1 3.2 ГГц, RAM 8 ГБ, DDR4, SSD 512 ГБ, Apple graphics 8-core, macOS, MYD92LL/A, серый космос, английская раскладка,14"" Ноутбук Xiaomi RedmiBook Pro14 I5-11320H 16G/512G XE Grey Integrated graphics JYU4379CN,15.6"" Ноутбук ASUS TUF Gaming F15 FX506LHB-HN333 1920x1080, Intel Core i5 10300H 2.5 ГГц, RAM 16 ГБ, DDR4, SSD 512 ГБ, NVIDIA GeForce GTX 1650, без ОС, 90NR03U2-M00JP0, graphite black,Покупателям,Apple MacBook Pro 16 2023 [MNW83_RUSG] (клав. РУС. грав.) Space Grey 16.2"" Liquid Retina XDR {(3456x2234) M2 Pro 12C CPU 19C GPU/16GB/512GB SSD},Ноутбук ASUS VivoBook Pro 15 M6500QH-HN034 (90NB0YJ1-M001N0),125 990 ₽,Ноутбук HUAWEI MateBook D16 RLEF-X i5/16GB/512GB Space Gray,Apple MacBook Air 13"" (M2, 8C CPU/8C GPU, 2022), 8 ГБ, 256 ГБ SSD, A2681 (MLY13) Сияющая звезда,Apple MacBook Air 13"" (M2, 8C CPU/8C GPU, 2022), 8 ГБ, 256 ГБ SSD, A2681 (MLY33)Полуночный черный,Ноутбук Xiaomi Mi Notebook Pro X 15.6"" i7 11370H/32Gb/1T/RTX 3050Ti OLED Grey (JYU4361CN),Ноутбук Xiaomi RedmiBook 15 JYU4525RU,Ноутбук Asus ROG Strix G15 G513IC-HN033 90NR0502-M007K0"
https://re-store.ru/catalog/Z124000H0/?utm_medium=cpc&utm_source=yandex&utm_campaign=cid%3A82425457_cn%3Adsa_feed_new_p_rf&utm_term=ph%3A3815958_kw%3A&utm_content=re%3A3815958%7Cgr%3A5176811078%7Cb%3A13937604931%7Cdrf%3Ano%7Cst%3Asearch%7Cs%3Anone%7Cp%3A3%7Cpt%3Aother%7Cdt%3Adesktop%7Ccgc%3A0&utm_id=82425457&yclid=4526856557176029183;Компьютерная техника;;
https://market.yandex.ru/product--videokarta-gigabyte-geforce-rtx-4060-ti-eagle-8-gb-gv-n406teagle-8gd/1866830853?sku=102029796762&utm_term=91031%7C102029796762&clid=1601&utm_source_service=web&utm_source=yandex&utm_medium=search&utm_campaign=ymp_offer_promo_april2023_best10_bko_dyb_search&utm_content=cid%3A86353695%7Cgid%3A5175045367%7Caid%3A13921844313%7Cph%3A3805533%7Cpt%3Apremium%7Cpn%3A1%7Csrc%3Anone%7Cst%3Asearch%7Crid%3A3805533%7Ccgcid%3A20729119&adjust_t=fs3pybh&adjust_ya_click_id=13306931160110071807&yclid=13306931160110071807&src_pof=1648&baobab_event_id=ln6f98wj1&wprid=1696101860070975-6045472875365124893-balancer-l7leveler-kubr-yp-sas-120-BAL-6162&icookie=d3ihxhZyI3N%2BVx24tsoZB5kK8lfkWDo6fJEikinOq8gF0orlRtSfIoAkTZw7Ny%2BCNkXzQFuqXfw9r0u92OZrM66OFO0%3D;Компьютерная техника;;Яндекс Маркет,Видеокарта GIGABYTE GeForce RTX 4060 Ti EAGLE, 8 ГБ (GV-N406TEAGLE-8GD)Вы смотрели,Полезные ссылки,Часто ищут,Перейти к содержанию (Alt + 0),Где купить,Самое важное,Товар у продавца,Описание,Товар на Маркете,Еще может подойтиВидеокарта GigaByte GeForce RTX 4060 Ti AORUS ELITE 2655Mhz PCI-E 8192Mb 18000Mhz 128 bit 2xHDMI 2xDP GV-N406TAORUS E-8GD,Видеокарта Gigabyte GeForce RTX 4070 12288Mb, Gaming OC 12 Gb (GV-N4070GAMING OC-12GD) 1xHDMI, 3xDP, Ret,Видеокарта MSI GeForce RTX 2060 SUPER VENTUS GP OC 8GB, Bulk,Видеокарта MSI GeForce RTX 4060 Ti VENTUS 2X BLACK 8G OC,Видеокарта GAINWARD (NED307T019P2-1047M) GeForce RTX 3070 Ti 8GB PHANTOM,Видеокарта Gigabyte RX7600 GAMING OC 8GB,Видеокарта GIGABYTE GeForce RTX 4070 WINDFORCE OC 12G GV-N4070WF3OC-12GD,Видеокарта MSI RTX4060Ti GAMING X 8GB GDDR6 DPx3 HDMI ATX 3FAN RTL,Видеокарта GIGABYTE GeForce RTX 3050 ELITE 8G (GV-N3050AORUS E-8GD), Retail,Продавцам,Видеокарта PCI-E 8Gb ASUS NV DUAL-RTX3060TI-O8GD6X RTX3060TI GDDR6 256bit GDDR6X 1680/19000 HDMIx1 D,GIGABYTE Видеокарта GIGABYTE GeForce RTX 4070 Ti GAMING OC 12GB (GV-N407TGAMING OC-12GD), Retail,Видеокарта Gigabyte RTX 3060 12Gb/GDDR6/192-bit GV-N3060GAMING OC-12GD 2.0,Коротко о товаре,Видеокарта Gigabyte RTX4060Ti EAGLE OC 8GB,Видеокарта MSI nVidia GeForce RTX 4060 Ti VENTUS 2X BLACK 8G OC PCI-E 8192Mb GDDR6 128 Bit Retail,Видеокарта 12 Gb MSI GeForce RTX3060 VISION 2X OC (RTX 3060 VENTUS 2X OC RU),49 990 ₽,Видеокарта Gigabyte GeForce RTX 4060 Ti 8192Mb, Aero OC 8 Gb (GV-N406TAERO OC-8GD) 2xHDMI, 2xDP, Ret,Видеокарта GIGABYTE GeForce RTX 3070 Gaming OC 8G (GV-N3070GAMING OC-8GD) (rev. 2.0), Retail,Характеристики,Видеокарта NVIDIA GeForce RTX 4060 Ti Palit Dual OC 8Gb (NE6406TT19P1-1060D),Видеокарта Colorful iGame GeForce RTX 4060 Ti Ultra W OC 8GB,Видеокарта MSI GeForce RTX 4060 Ti GAMING X TRIO 8G, RTL,Видеокарта Gigabyte GeForce RTX 4060 Ti 8192Mb, Gaming OC 8 Gb (GV-N406TGAMING OC-8GD) 2xHDMI, 2xDP, Ret,Видеокарта MSI GeForce RTX 3060 Ti 8192Mb, Ventus 3X OC LHR (RTX 3060 Ti Ventus 3X OC LHR) 1xHDMI, 3xDP, Ret,Сотрудничество,Видеокарта GigaByte GeForce RTX 3060 Eagle OC 12G LHR 1807Mhz PCI-E 4.0 12288Mb 15000Mhz 192-bit 2xHDMI 2xDP GV-N3060EAGLE OC-12GD Rev. 2.0,Видеокарта GIGABYTE GeForce RTX 3060 VISION OC 2.0 12G,Видеокарта Gigabyte Gaming nVidia RTX 4070 Ti 12GB (GV-N407TEAGLE OC-12GD 2.0),Видеокарта Palit nVidia GeForce RTX4060 TI Dual GDDR6 PCI-E 2310MHz 8192Mb 18000Mhz 128-bit HDMI DP NE6406T019P1-1060D,Видеокарта GIGABYTE GeForce RTX 3070 Ti GAMING OC 8G (GV-N307TGAMING OC-8GD), Retail,Видеокарта GIGABYTE GeForce RTX 4060 Ti AERO OC 8GB (GV-N406TAERO OC-8GD),57 455 ₽,Покупателям,Видеокарта MSI GeForce RTX 4060 GAMING X 8G,Видеокарта MSI (RTX 4060 Ti GAMING X 8G) GeForce RTX 4060 Ti 8GB GAMING X,Видеокарта RTX4060 8GB Gigabyte AORUS ELITE (GV-N4060AORUS E-8GD) 8GB GDDR6 128-bit DPx2 HDMIx2 3FAN RTL,Видеокарта 12 Gb MSI GeForce RTX 3060 GAMING X (RTX 3060 GAMING X 12G)
https://www.mvideo.ru/komputernye-komplektuushhie-5427/videokarty-5429;Компьютерная техника;;
https://www.eldorado.ru/c/videokarty/?utm_source=yandex&utm_medium=organic&utm_campaign=yandex&utm_referrer=yandex;Компьютерная техника;;
https://www.apple.com/ru/airpods/;Фото, видео и аудиотехника;;AirPods – Apple (RU),AirPodsНижний колонтитул Apple,Выберите свои AirPods.,AirPods Max,AirPods,AirPods ProAirPods Max,Подключаются к устройствам с волшебной лёгкостью.,О компании Apple,Для бизнеса,Учётная запись,AirPods 2‑го поколения,Выбирайте и покупайте,Apple Store,AirPods Pro,Для образования,Сервисы,Ценности Apple,AirPods 3‑го поколения
https://www.apple.com/ru/airpods-max/;Фото, видео и аудиотехника;;AirPods Max – Apple (RU),AirPods MaxНижний колонтитул Apple,Магия AirPods,Качество звука,Выберите свои AirPods.,Посмотрите на них в дополненной реальности,ДизайнApple Store,Ценности Apple,AirPods 3‑го поколения,Продуманно просто.,Эта музыка будет долгой.,AirPods 2‑го поколения,Выбирайте и покупайте,Сказочно красивый звук.,Ещё больше магии.,О компании Apple,Вычислительное аудио. Слушайте, это прекрасно.,Для образования,Пять цветов. Никакой монотонности.,Абсолютно оригинальная композиция.,AirPods Max,Для бизнеса,Учётная запись,AirPods Pro,Сервисы,Чехол в помощь аккумулятору.
https://market.yandex.ru/product--apple-naushniki-apple-airpods-max-zelenyi/947478402?utm_term=16265387%7C947478402&clid=1601&utm_source_service=web&utm_source=yandex&utm_medium=search&utm_campaign=ymp_offer_dp_elektronika_model_2_dyb_search_rus&utm_content=cid:83032985%7Cgid:5283823995%7Caid:14997855281%7Cph:4536452%7Cpt:other%7Cpn:2%7Csrc:none%7Cst:search%7Crid:4536452%7Ccgcid:20726610&adjust_t=fs3pybh&adjust_ya_click_id=16516174369602928639&referrer=reattribution%3D1&yclid=16516174369602928639&baobab_event_id=ln6fncy9ua&wprid=1696102497101214-9522035937294245962-balancer-l7leveler-kubr-yp-sas-149-BAL-4501&src_pof=1601&icookie=d3ihxhZyI3N%2BVx24tsoZB5kK8lfkWDo6fJEikinOq8gF0orlRtSfIoAkTZw7Ny%2BCNkXzQFuqXfw9r0u92OZrM66OFO0%3D;Фото, видео и аудиотехника;;Яндекс Маркет,Apple Наушники Apple AirPods Max ЗеленыйВы смотрели,Полезные ссылки,Часто ищут,Перейти к содержанию (Alt + 0),Где купить,Товар у продавца,Описание,Товар на Маркете,Еще может подойтиApple AirPods Pro (2-е поколение),Зарядный кейс для Apple AirPods 3 (3 го поколения),AKG K712PRO референсные наушники,Силиконовые амбушюры, накладки для наушников Apple AirPods Max,Чехол для Marshall Mode EQ, Minor II,Силиконовый чехол для наушников AirPods 3,Амбушюры для наушников AirPods Pro 1, 2 (4 размера XS, S, M, L),Амбушюры для наушников Apple AirPods Max,Чехол для AirPods max WIWU Chicago Case, синий,Левый наушник Apple AirPods Pro (L), белый,Беспроводные наушники Apple левый наушник AirPods 3 (L), белый,Продавцам,Коротко о товаре,Правый наушник Apple AirPods 3 (3 го поколения) (R) белый,Беспроводные наушники Apple AirPods Max, розовый,Кейс для хранения гарнитуры AirPods Max с функцией Smart Sleep (черный),Характеристики,Футляр Apple AirPods 2 Case (White),Беспроводные наушники Apple Правый наушник AirPods 2 (R) второе поколение, белый,Беспроводной зарядный футляр для APPLE AirPods MR8U2,Зарядный футляр для наушников Apple AirPods 1/2 (A1602) кейс, Новый, белый,Сотрудничество,Беспроводные наушники Apple Левый наушник AirPods Pro 2 (L), белый,Правый наушник Apple AirPods Pro,Беспроводные наушники Apple Левый наушник AirPods 2 (L) второе поколение, белый,Покупателям,Чехол для наушников Marshall Major, Major II, Major III, Monitor, MID,Чехол футляр сумка для накладных больших беспроводных наушников,Зарядный кейс для наушников Apple Airpods Pro (2-го поколения),Подставка для наушников с беспроводной зарядкой Satechi 2-in-1 Headphone Stand with Wireless Charger (ST-UCHSMCM),Чехол сумка футляр для накладных полноразмерных больших наушников DJ / красный,68 715 ₽,Чехол для наушников Apple Airpods Pro 2 (2022) с усиленной защитой карбон черный,Футляр Apple AirPods Pro
https://market.yandex.ru/search/?text=beats%20наушники&clid=1601&cpa-perf=1&utm_source_service=web&utm_source=yandex&utm_medium=search&utm_campaign=ymp_cat_dp_elektronika_naushniki_i_bluetoothgarnitury_syb_search_rus%7C90555&utm_content=cid:61933068%7Cgid:4818490008%7Caid:11720597948%7Cph:36372917991%7Cpt:premium%7Cpn:1%7Csrc:none%7Cst:search%7Ccgcid:0&utm_term=beats%20наушники&adjust_t=fs3pybh&adjust_ya_click_id=16196256513459224575&referrer=reattribution%3D1&etext=&src_pof=901&icookie=OOoe8hYg%2BhFaZoCwgAspdwusUjrj4w/sENR8%2BUcMpfQ/SONCe6lprSnI25LD9rGR2iZ76ppr3pphrNsJ1jqjzLH3aH0%3D&wprid=255259827163656902724989025485082&yclid=5748748936340904978;Фото, видео и аудиотехника;;beats наушникиЯндекс Маркет,Beats%20наушникиВы смотрели,Полезные ссылки,Рекомендации на основе просмотренного,Перейти к содержанию (Alt + 0),Представление выдачи,Фильтры,Сортировка10 590 ₽,Продавцам,Покупателям,Беспроводные наушники Beats Flex All-Day Wireless, оригинальный черный,Наушники беспроводные Hoco EW42 bluetooth для телефона айфон, samsung galaxy, readmi pro 2, 3 / блютуз наушник для iphone, самсунг безпроводные,Сотрудничество,7 390 ₽,720 ₽,Беспроводные наушники Marshall Major IV, mini jack 3.5 mm, коричневый
https://re-store.ru/accessories/headphones/brand_beats/;Фото, видео и аудиотехника;;
https://www.avito.ru/moskva?q=наушники+beats;Фото, видео и аудиотехника;;наушники beats - Авито | Объявления в Москве: купить вещь, выбрать исполнителя или работу, подобрать недвижимость и транспорт по низкой цене | Авито,Объявления по запросу «наушники beats» в МосквеНаушники Beats EP,Наушники беспроводные beats studio wireless b0501,Beats Studio Buds + В Наличии Оригинал,Беспроводные наушники beats,Наушники beats + чехол,Наушники Beats,Beats Fit Pro x Kim Kardashian В Наличии Оригинал,Наушники beats X,Наушники Beats PRO,Беспроводные наушники beats studio 2,Наушники beats solo hd,Наушники накладные Beats Solo 2 red,Наушники beats by Dre,Наушники Beats Fit Pro Black/Purple/Blue/Yellow,Наушники Beats Fit Pro Yellow,Беспроводные наушники Monster Beats,Наушники Beats Studio 3 Wireless,Наушники Beats Solo 3 Оригинал Pink/Red/Black,Наушники beats + сенсорный плеер 16GB,Наушники Beats Pro by dr. dre silver,Наушники beats studio 3 (коллаб с амкалом ),Наушники beats Solo 3 Wireless,Наушники Beats by Dr.Dre Studio,Наушники beats pro,Наушники beats solo 3 Wireless оригинал,Наушники beats by Dre studio фиолетовые,Наушники Beats ep by Apple,Наушники Beats Studio Buds Оригинал,Наушники проводные от Apple, Beats EP (Новые),Beats pro by dr. Dre наушники проводные оригинал,Наушники Beats Solo 3 Wireless Rose Gold,Наушники beats mixr(проводные) оригинал,Beats Studio 2 Wireless,Беспроводные наушники Beats Studio Buds+ бежевые,Коробка от наушников Beats studio,Наушники/гарнитура beats, kida, bose,Беспроводные наушники beats x,Наушники beats,Загрузите приложение Авито,Наушники beats by dr dre,Наушники Beats Solo 2, розовые,Наушники Beats studio buds,Наушники beats by dr.dre monster на запчасти,Наушники beats studio 3 wireless,Наушники Beats Solo HD,Наушники Beats studio 3 wireless
https://boxberry.ru/market/category/naushniki-i-bluetooth-garnitury/brand-beats/;Фото, видео и аудиотехника;;Купить Наушники и Bluetooth-гарнитуры Beats в интернет каталоге с доставкой | Boxberry,Наушники и Bluetooth-гарнитуры BeatsИзбранное0
https://www.gazprombank.ru/special/autocredit/?utm_source=yandex&utm_medium=cpc&utm_campaign=cid:97186372%7Ccn:Y%7Cmsk%7CGeneral%7Cregular%7CGeo%7Crk:general%7Cd:perform%7Cpn:auto_credit%7Crt:search%7Cag:icontext&utm_content=ad:15141244613%7Cst:search%7Cs:none%7Cpt:premium%7Cdt:desktop%7Ccmid:97186372%7Cgrid:5302289615%7Crgid:21621%7Crgn:Реутов%7Ccoefgoal:19152618%7C&utm_term=кредит%20на%20машину%202023%7Cph:47679562698&yclid=13459378789464670207;Банки и кредиты;;Кредит на авто и другие цели — «Газпромбанк» (Акционерное общество),Кредит на авто и другие целиРассчитайте автокредит/кредит онлайн,Преимущества,Заявка на автокредит/кредитПараметры кредита
