link; label;Unnamed: 2;metadata
https://postel-deluxe.ru/vanna/kovriki-vannaia.html?utm_source=yandex&utm_medium=cpc&utm_campaign=50092653&utm_term=коврик%20для%20ванной&banner=9354024581&m1=1&key=коврик%20для%20ванной&yclid=14815664355631955967;Товары для дома;;Покупайте коврики для ванной в интернет-магазине с доставкой,Качественные коврики для ванной по выгодным ценамКоврик для ванной Флинн цвет: темно-серый (50х60 см, 60х100 см),Коврик для ванной Рапсодия цвет: белый,Коврик для ванной Родос цвет: серый (60х90 см),Коврик для ванной Salida цвет: бежевый,Коврик для ванной Рапсодия цвет: бежевый (50х70 см),Коврик для ванной Родос цвет: серо-зеленый (60х90 см),Коврик для ванной Winter Soft цвет: желтый (50х70 см),Коврик для ванной Pompom цвет: синий (60х90 см),Коврик для ванной Marty (60х100 см,40х60 см),Коврик для ванной Рапсодия цвет: бежевый,Коврик для ванной Erciyes цвет: серый (50х60 см, 60х100 см),Коврик для ванной Em цвет: бежевый (60х50 см,60х100 см),Коврик для ванной Конлет цвет: пудровый (50х60 см, 60х100 см),Коврик для ванной Донати цвет: графитовый (60х90 см),Коврик для ванной Berceste цвет: серый (55х60 см, 60х100 см),Коврик для ванной Мира цвет: белый,Коврик для ванной Dafne цвет: мокко (50х70 см,60х100 см),Коврик для ванной Dafne цвет: кофейный (50х70 см),Коврик для ванной Эйдан цвет: серый (50х60 см, 60х100 см),Коврик для ванной Kisha цвет: голубой (50х60 см,60х100 см),Коврик для ванной Рапсодия цвет: белый (50х70 см),Коврик для ванной Ursula цвет: бежевый (60х100 см,50х50 см),Коврик для ванной Marielle цвет: кремовый (60х50 см,60х100 см),Коврик для ванной Malika (40х50 см,50х80 см),Коврик для ванной Тира цвет: экрю,Коврик для ванной Энсон цвет: белый (60х90 см),Коврик для ванной Leo цвет: серебристый (60х100 см,40х60 см),Коврик для ванной Berceste цвет: бежевый (55х60 см, 60х100 см),Коврик для ванной Squares цвет: белый (50х70 см),Коврик для ванной Damali (40х50 см,50х80 см),Коврик для ванной Mathilda цвет: бежевый (50х80 см),Коврик для ванной Дайвин цвет: серый (60х90 см),Коврик для ванной Рапсодия цвет: светло-серый (50х70 см),Коврик для ванной Рапсодия цвет: темно-серый (50х70 см),Коврик для ванной Конлет цвет: экрю (50х60 см, 60х100 см),Коврик для ванной Balthazar цвет: кремовый (60х50 см,60х100 см),Коврик для ванной Lizzie (60х100 см,40х60 см),Коврик для ванной Hester цвет: пудровый (60х50 см,60х100 см),Коврик для ванной Filomena цвет: белый,Коврик для ванной Альдо цвет: бежевый (60х90 см),Коврик для ванной Tarma цвет: бирюзовый (50х70 см),Коврик для ванной Родос цвет: белый (60х90 см),Коврик для ванной Террон цвет: белый, бежевый (60х90 см),Коврик для ванной Sofie цвет: персиковый,Коврик для ванной Альдо цвет: серый (60х90 см),Коврик для ванной Арзони цвет: серый, голубой (60х90 см),Коврик для ванной Рапсодия цвет: темно-серый (70х120 см),Коврик для ванной Toledo (50х80 см),Коврик для ванной Berceste цвет: бежевый (70х120 см),Коврик для ванной Леаль цвет: белый, бежевый (60х90 см),Коврик для ванной Мира цвет: серый,Коврик для ванной Araldico цвет: черный (60х90 см),Коврик для ванной Кайлан цвет: бело-бирюзовый (60х100 см),Коврик для ванной Marielle цвет: серый (60х50 см,60х100 см),Коврик для ванной Klementin цвет: бежевый (60х90 см),Коврик для ванной Ana цвет: светло-бежевый (50х80 см),Коврик для ванной Родос цвет: бежевый (60х90 см),Коврик для ванной Дайвин цвет: белый (60х90 см),Коврик для ванной Эрве (60х90 см),Коврик для ванной Тира цвет: белый
https://market.yandex.ru/product--vaza-pasabahce-flora-43407b/1779143119?sku=101861316731&utm_term=4992497%7C101861316731&clid=1601&utm_source_service=web&utm_source=yandex&utm_medium=search&utm_campaign=ymp_offer_dp_dom_bko_dyb_search_rus&utm_content=cid%3A64762544%7Cgid%3A4662475652%7Caid%3A11052503588%7Cph%3A1872307%7Cpt%3Apremium%7Cpn%3A1%7Csrc%3Anone%7Cst%3Asearch%7Crid%3A1872307%7Ccgcid%3A20726417&adjust_t=fs3pybh&adjust_ya_click_id=14774376116796784639&referrer=reattribution%3D1&yclid=14774376116796784639&src_pof=1648&baobab_event_id=ln6fxuf51&wprid=1696103007748679-237640977245100548-balancer-l7leveler-kubr-yp-sas-102-BAL-7583&icookie=d3ihxhZyI3N%2BVx24tsoZB5kK8lfkWDo6fJEikinOq8gF0orlRtSfIoAkTZw7Ny%2BCNkXzQFuqXfw9r0u92OZrM66OFO0%3D&_redirectCount=1;Товары для дома;;"Яндекс Маркет,Ваза стеклянная круглая высотой 79 мм, PasabahceВы смотрели,Полезные ссылки,Часто ищут,В комплекте дешевле,Перейти к содержанию (Alt + 0),Где купить,Самое важное,512,₽,Товар у продавца,Описание,Товар на Маркете,Еще может подойтиВаза Флора 79мм 43407SLB,Ваза для сухоцветов ""Кубы"" высота 10 см,216 ₽,Ваза шар стеклянная для цветов и сухоцветов в бокал,Ваза Шаровая, стекло, 2 литра, высота 130 мм диаметр 157 мм, Evis 2067,Evis Ваза ""Цилиндр"" 15х8 см, 0,5л 2931 прозрачная,""Флора (Flora)"" Ваза для цветов стеклянная 0,8л, д8см, h10,5см, форма шара, цветная коробка, Pasabahce (Россия),Ваза для цветов Flora h 26.5 см, (без упаковки) Pasabahce Бор 3080172,Ваза шар гладь 7708 в.80 д.100,Ваза стеклянная декоративная Pasabahce ""Flora"", высота 7,9 см.,Ваза для цветов и сухоцветов стеклянная с ручкой подсвечник,Ваза стеклянная круглая высотой 103 мм, Pasabahce,Ваза ""Гранд"" 5х15см, 0,5л прозрачная 758511,Продавцам,PASABAHCE Ваза для цветов, флора 79ММ,Ваза «Бренди» 2 л стекло цвет прозрачный 21см,Коротко о товаре,Высокая стеклянная ваза для цветов букетов и композиций, высота 26,5 мм, Pasabahce,Характеристики,Стеклянная ваза в виде шара Pasabahce серии Flora, для цветов и конфет, высотой 102,5 мм. (Пашабахче/Флора),Ваза стеклянная трубка 25см для цветов,Ваза шар стеклянная для цветов и сухоцветов,Ваза-шар Flora h 7.9 см, Pasabahce Бор 3080413,246 ₽,Сотрудничество,Ваза 7,9см Флора 43407SLB без коробки,Ваза стеклянная прозрачная, высота 144 мм, Pasabahce,Ваза 10.5см флора 43417SLB без подарочной коробки,Ваза ИКЕА МУНТЛИГ, прозрачный,Ваза для цветов шар FLORA h10,2 см стеклянная декоративная,Ваза ИКЕА КОНСТФУЛЛ, матовое стекло/зеленый,Цветочный горшок BOTANIKA 135мм (гладкий),Покупателям,Ваза-шар Neman 400мл, 100х100х77мм, прозрачное стекло,Ваза ИКЕА ТАЙТ, прозрачный,Ваза ИКЕА БЕРЭКНА, темно-розовый,Ваза «Анабель» стекло цвет прозрачный 17см,Ваза ""Анабель"" шаровая с косым резом d-12см; h-9.5см, 0,8л Evis 758477"
https://hoff.ru/catalog/tovary_dlya_doma/dekor/vazy_i_tsvety/vazy/vaza_bb620_id8427219/?articul=80403450&utm_source=yandex.direct&utm_medium=cpc&utm_term=&utm_campaign=dsagallery-category-tdd-tdd-gp-mskmo-vse-cpa-nan-93756999&utm_content=v2%7C%7C14838273973%7C%7C4679850%7C%7C%7C%7C4%7C%7Cpremium%7C%7Cnone%7C%7Csearch%7C%7Cno&utm_adtarget=93756999_ТДД%20-%20Декор%20-%20Фид_4679850_no_none&calltouch_tm=yd_c:93756999_gb:5265444280_ad:14838273973_ph:4679850_st:search_pt:premium_p:4_s:none_dt:desktop_reg:21621_ret:4679850_apt:none&yclid=818972149286699007&utm_referrer=https%3A%2F%2Fyandex.ru%2F;Товары для дома;;
https://market-delivery.yandex.ru/retail/perekrestok/product/92b134bf-3bff-46ea-8ea5-fa92a0cc5aae?utm_medium=cpc&utm_source=yasearch&utm_campaign=96716703.%5BDC%5DMX_Retail-goal_RU-MOS-MOW_PEREKRESTOK_gallery_feed_segmentA_search_NU&utm_content=15060474342&utm_term=Все%20товары%7C%7Cpid%7C4585292%7Caid%7C15060474342%7Ctype3%7Cdesktop%7Cnone%7Csearch&yclid=14198230509293142015;Товары для дома;;
https://market.yandex.ru/product--cactus-cs-mf01-mnogorazovaia-salfetka/1777931149?utm_term=91078%7C1777931149&clid=1601&utm_source_service=web&utm_source=yandex&utm_medium=search&utm_campaign=ymp_offer_dp_komputer_model_8_bko_dyb_search_rus&utm_content=cid%3A94475516%7Cgid%3A5283982283%7Caid%3A14999178911%7Cph%3A4537648%7Cpt%3Apremium%7Cpn%3A7%7Csrc%3Anone%7Cst%3Asearch%7Crid%3A4537648%7Ccgcid%3A20728017&adjust_t=fs3pybh&adjust_ya_click_id=9942565992741208063&referrer=reattribution%3D1&yclid=9942565992741208063&src_pof=1648&baobab_event_id=ln6fygsk2&wprid=1696103028747900-13398041335616944803-balancer-l7leveler-kubr-yp-sas-50-BAL-1323&icookie=d3ihxhZyI3N%2BVx24tsoZB5kK8lfkWDo6fJEikinOq8gF0orlRtSfIoAkTZw7Ny%2BCNkXzQFuqXfw9r0u92OZrM66OFO0%3D;Товары для дома;;Яндекс Маркет,Cactus CS-MF01 многоразовая салфеткаВы смотрели,Полезные ссылки,Часто ищут,Перейти к содержанию (Alt + 0),Где купить,Товар у продавца,Описание,Товар на МаркетеПродавцам,Покупателям,186 ₽,Коротко о товаре,Сотрудничество,162 ₽,225 ₽,Характеристики,219 ₽
https://www.wildberries.ru/catalog/dlya-doma/tovary-dlya-uborki/shvabry;Товары для дома;;Покупателям,Подтвердите свой возраст,Партнерам,Компания,Мы в соцсетях,Приложение Wildberries,Наши проекты
https://sfish.ru/;Рыбалка;;Журнал Спортивное рыболовство - официальный сайт,Из первых уст,Бесшумный выстрел на голодный желудок,Школа для новичка,Семьей на рыбалку,С ультралайтом за речными монстрами,Причуды осеннего карпа,Спортивное рыболовство №5 сентябрь/октябрь 2023,За рыбой вокруг света,Обзор рынка,Снасть и тактика,Рыбалка. Северо-Запад,Новости спорта,Методы ловли,Советы Мастера,Закон есть закон,Вопросы экологии,Техника на рыбалке,По родным просторамС 16 по 19 февраля 2023 г. 1-я Международная выставка «МИР Охоты и Рыбалки»,С 16 по 19 марта 2023 г. Выставка «Охота. Рыболовство. Активный отдых» в Ростове-на-Дону,С 24 по 27 августа 2023 г. Выставка «Мир охоты и рыбалки. 2023» в Москве,С 7 по 10 сентября 2023 г. Выставка «Охота и рыболовство на Руси» в Москве,С 25 по 28 мая 2023 г. Выставка «Охота. Рыболовство. Отдых. 2023» в Иркутске,С 9 по 12 февраля 2023 г. Выставка «Fish and Fun» в Москве
https://leska.media/;Рыбалка;;Леска — журнал о рыбалке и активном отдыхе,Леска — журнал о рыбалке и активном отдыхеКак подготовиться к зимней рыбалке: полный комплект оборудования и экипировки,Нерестовый запрет. Что важно знать, чтобы не нарушить закон,Как поймать большую щуку осенью. Простые советы для крупного улова,Рыбалка на Белом море: ловим навагу зимой в Приморском крае,Открываем сезон ловли окуня со льда,Что расскажет победитель Sprut Fest 6 «Нарвский хищник 2022»: интервью с Маратом Деевым,Окей, гугл. Я новичок в рыбалке, в каких турнирах я могу участвовать?,Расскажем,5 советов, как успешно ловить форель,Сезон летней рыбалки закончен. Как подготовить снасти к следующему сезону?,PAL — как устроен самый популярный рыболовный турнир России. Итоги PAL-2022Какую катушку выбрать для трофейной подлёдной рыбалки?,«Народный проект Астрахань». Секреты ловли сома,Как поймать большую щуку осенью. Простые советы для крупного улова,Обзор Александра Филина из «Диалогов о рыбалке»: катушка 13 FISHING Concept Z и спиннинг 13 FISHING Fate Black,Что делать с леской на зимней рыбалке, чтобы на ней не образовался лёд?,Почему рекомендуют рыбачить именно утром?,Как спасти приманку при зацепе, когда ловишь с берега?,PAL — как устроен самый популярный рыболовный турнир России. Итоги PAL-2022
https://vk.com/fishingroup;Рыбалка;;Серия изданий «РЫБАЛКА-GROUP» | VK,Серия изданий «РЫБАЛКА-GROUP» | VKСерия изданий «РЫБАЛКА-GROUP»Notities van de groep ZoekenAnnuleren,ProductenArtikelsFotoVideoMuziekAdressenDiscussiesDiensten
https://megamarket.ru/catalog/details/udochka-cvetnaya-teleskopicheskaya-45-metra-s-katushkoy-leskoy-i-poplavkom-600008794300/?utm_source=yandex&utm_medium=cpc&utm_campaign=smm_search_dsa_galereya:11_sport_i_aktivnyy_otdyh_[msk_mo]_%7C74718756%7C&utm_term=3377979.12200032480.&utm_content=4923884792.premium.1.0.none.21621.Реутов&adjust_ya_click_id=11554611625211461631&adjust_campaign=smm_search_dsa_galereya%3A11_sport_i_aktivnyy_otdyh_%5Bmsk_mo%5D&adjust_tracker=4a3jxi1_j6n0ehs&yclid=11554611625211461631;Рыбалка;;
https://kaida-fish.ru/catalog/kdf_troutex_125_sn23_3_gr/forelevaya_blesna_kdf_troutex_125_sn23_3_gr_30_mm_tsv_h13_31a_6/?yclid=15154038174336679935;Рыбалка;;Server disconnected without sending a response.
https://kaida-fish.ru/catalog/order_/spinning_kaida_order_2_10_m_test_0_5_3_gr_art_228_210/?yclid=16100362476369477631;Рыбалка;;Server disconnected without sending a response.
https://ugra-sport.ru/shop/leski/pletenye-shnury/92705/strong-line/pletenyy-shnur-mottomo-strong-line-pe-0-6-4kg-150m-dark-green.html?utm_source=yandex&utm_medium=cpc&utm_campaign=products_search&yclid=3697400962973433855;Рыбалка;;Плетеный шнур Mottomo Strong Line PE Dark Green #0.6/4kg 150m - купить в интернет-магазине, каталог и цены с доставкой по России,Плетеный шнур Mottomo Strong Line PE Dark Green #0.6/4kg 150m
https://1000-podarkov.ru/chto-podarit-devushke/;Подарки и цветы;;
https://2cherry.ru/blog-o-podarkah/Chto-podarit-devushke/;Подарки и цветы;;Что подарить девушке (213 идей),Что подарить девушке? (213 идей)Уход за собой,Для дома,Спортивным девушкам,Букеты,Аксессуары,В машину,Игрушки,Курсы и обучение,Экстремальные,Живые,Дополнения,Творческий,Одежда,Необычное,Еда и напитки,18+,Игры,Посуда,Украшения,Техника,Для компьютера,Эмоциональные и романтичныеИзбранные товары
https://www.kp.ru/expert/podarki/chto-podarit-parnyu-na-den-rozhdeniya/;Подарки и цветы;;150+ идей, что подарить парню на день рождения: список оригинальных и недорогих подарков парню на день рождения,150+ идей, что подарить парню на день рожденияОригинальные идеи подарков для парня на день рождения,Как выбрать подарок парню на день рождения,Топ-7 лучших идей подарков парню на день рождения3. Игровая приставка,6. Духи,4. Подушка,2. Инструменты,5. Подарочный сертификат,1. Электробритва,7. Квадрокоптер
https://journal.citilink.ru/articles/chto-podarit-parnyu-17-idej-dlya-otdyha-i-uspehov-v-rabote-i-sporte/;Подарки и цветы;;Что подарить парню: 17 идей для отдыха и успехов в работе и спорте — Журнал Ситилинк,Что подарить парню: 17 идей для отдыха и успехов в работе и спортеКак ничего не пропустить?,Путешественнику для комфорта в пути,Здоровье и красота,Творческому человеку для концентрации,У нас ещё много всего интересного,Подарки,ПК и игры,Спортсмену для продуктивных тренировок,Геймеру и любителю гаджетов — для безопасности и настроения,Трудоголику для эффективной работыМассажер, чтобы быстрее восстанавливаться,Лампа, чтобы профессионально выглядеть на созвонах,Беспроводная зарядка, чтобы заряжать все гаджеты разом,Чехол, чтобы защитить ноутбук,Увлажнитель воздуха, чтобы легче дышалось и думалось,Инструменты для починки гаджетов и техники,Фигурки, чтобы собирать любимых героев,Смарт-часы, чтобы следить за показателями и оставаться на связи,Набор для умного дома, чтобы защититься от краж,Спортивные очки, чтобы защитить глаза от ветра и солнца,Блокнот, чтобы не упустить идею,Мониторные наушники, чтобы отстраниться от суеты,Термос или термокружка, чтобы сердце грел горячий чай,Кемпинговый фонарь для комфорта в любых условиях,Электрический штопор — открывать вино эффектнее, чем сомелье,Влагозащищенная колонка, чтобы возить музыку с собой,Блендер, чтобы перекус был всегда,Напишите, что вы думаете, или поделитесь своим опытом.
https://megacvet24.ru/rozy-opt/?utm_source=eLama-yandex&utm_medium=cpc&utm_campaign=ОПТ%20S%20(90%)21(100)(33%)(571)(664)(У)(ПЗП)%7C66322058&utm_content=cid%7C66322058%7Cgid%7C4714361963%7Caid%7C11241012639%7Cadp%7Cno%7Cdvc%7Cdesktop%7Cpid%7C34374609934%7Crid%7C34374609934%7Cdid%7C34374609934%7Cpos%7Cpremium1%7Cadn%7Csearch%7Ccrid%7C0%7C&utm_term=рижский%20рынок&yclid=753146197859631103;Подарки и цветы;;
https://www.rigamarket.net/;Подарки и цветы;;Рижский рынок, доставка цветов по Москве!,Популярные цветыНовая коллекция,4 веские причины выбрать нас!,Как оформить заказ ?9 лет в цветочном деле
https://www.rigamarket.net/;Подарки и цветы;;Рижский рынок, доставка цветов по Москве!,Популярные цветыНовая коллекция,4 веские причины выбрать нас!,Как оформить заказ ?9 лет в цветочном деле
https://www.rigamarket.net/;Подарки и цветы;;Рижский рынок, доставка цветов по Москве!,Популярные цветыНовая коллекция,4 веские причины выбрать нас!,Как оформить заказ ?9 лет в цветочном деле
https://www.rigamarket.net/;Подарки и цветы;;Рижский рынок, доставка цветов по Москве!,Популярные цветыНовая коллекция,4 веские причины выбрать нас!,Как оформить заказ ?9 лет в цветочном деле
https://promo-msk.gazelkin.ru/brand?utm_source=direct&utm_medium=cpc&utm_campaign=GZ_gruz_yandex_poisk_msk_gruz-dostavka&utm_term=доставка%20груза&utm_content=campaignid=91480961_groupid=5248194671_adid=14712252422_device=desktop_geo=Реутов_source=none__v3%7C%7C14712252422%7C%7C46153000088%7C%7Cдоставка%20груза%7C%7C2%7C%7Cpremium%7C%7Cnone%7C%7Csearch%7C%7Cno%7C%7C91480961%7C%7C5248194671&calltouch_tm=yd_c:91480961_gb:5248194671_ad:14712252422_ph:46153000088_st:search_pt:premium_p:2_s:none_dt:desktop_reg:21621_ret:46153000088_apt:none&yclid=5926099387475296255;Грузоперевозки и транспортные услуги;;Грузовое Такси Газелькин,
https://www.dellin.ru/?utm_source=AIS-YDS&utm_medium=cpc&utm_campaign=NST-NB-NA-75803391-75803391-DL_AIS_Y_MSK_SPB_RSYA_GENERAL_MASTER&utm_term=---autotargeting&ad=12350618809&phrase=39651035058&retargeting=39651035058&gbid=4955053160&yclid=16064811422760828927;Грузоперевозки и транспортные услуги;;
https://www.baikalsr.ru/?utm_source=yandex&utm_medium=cpc&utm_campaign=97032931.obschie_rf_poisk_vit&utm_position=other.2&utm_term=&yclid=16492725814302867455;Грузоперевозки и транспортные услуги;;[Errno 111] Connection refused
https://ltl.cdek.ru/?utm_source=yandex&utm_medium=cpc&utm_campaign=LTL_МК&utm_content=k50id%7C0100000047419292530_47419292530%7Ccid%7C97156273%7Cgid%7C5296451157%7Caid%7C15097266862%7Cadp%7Cno%7Cpos%7Cother4%7Csrc%7Csearch_none%7Cdvc%7Cdesktop%7C%dop%&yclid=9600683935813074943;Грузоперевозки и транспортные услуги;;LTL СДЭК | Перевозка сборных грузов,Терминалы СДЭК и пункты выдачи,перевозка сборных грузовдля вашего бизнесаСтоимость услуги актуальна при наличии договора со СДЭК,Об услуге,Перевезем любой груз, если он подходит под указанные габариты и не запрещен законами страны,Калькулятор,Доставим ваш груз,Заключить договор,Дополнительные услугиТовары,Материалы, технику,,Заказы
