link; label;Unnamed: 2;metadata
https://pecom.ru/marketplace/?utm_source=yandex&utm_medium=cpc&utm_campaign=context_ya_retail_rf_poisk_a&utm_content=yandex_direct%7Ccid_95746911%7Cgid_5283075015%7Cad_14991623482%7Cph_47065556507%7Ccrt_0%7Cpst_other%7Cps_1%7Csrct_search%7Csrc_none%7Cdevt_desktop%7Cret_47065556507%7Cgeo_21621%7Ccf_0%7Cint_%7Ctgt_47065556507%7Cadd_no&utm_term=---autotargeting&yclid=9315700041140666367;Грузоперевозки и транспортные услуги;;The read operation timed out
https://profi.ru/raznoe/gruzoperevozki/;Грузоперевозки и транспортные услуги;;Услуги грузоперевозок в Москве — 3676 специалистов,,Услуги грузоперевозок в МосквеСпроси профиBeta,Цены на похожие услуги,Примеры работ специалистов по грузоперевозкам,Похожие страницы,Услуги грузоперевозок – отзывы в Москве,Средняя стоимость услуг грузоперевозок в Москве,Все профи в одном приложенииВы профи?,900 ₽,Как это работает
https://market.yandex.ru/product--bumaga-tsvetnaia-staff-profit-a4-80-g-m2-100-l-5-tsv-kh-20-l-pastel-dlia-ofisa-i-doma-110889/579678009?sku=100787861786&utm_term=91046%7C100787861786&clid=1601&utm_source_service=web&utm_source=yandex&utm_medium=search&utm_campaign=ymp_offer_dp_komputer_feed_3_msku_1_bko_dyb_search_rus&utm_content=cid%3A84222270%7Cgid%3A5145391811%7Caid%3A13621957322%7Cph%3A3597384%7Cpt%3Apremium%7Cpn%3A2%7Csrc%3Anone%7Cst%3Asearch%7Crid%3A3597384%7Ccgcid%3A20728017&adjust_t=fs3pybh&adjust_ya_click_id=5960124735116279807&referrer=reattribution%3D1&yclid=5960124735116279807&src_pof=1648&baobab_event_id=ln6gb6yl0&wprid=1696103630293910-6565561697530619483-balancer-l7leveler-kubr-yp-vla-141-BAL-4195&icookie=d3ihxhZyI3N%2BVx24tsoZB5kK8lfkWDo6fJEikinOq8gF0orlRtSfIoAkTZw7Ny%2BCNkXzQFuqXfw9r0u92OZrM66OFO0%3D;Канцелярские товары;;Яндекс Маркет,Перейти к содержанию (Alt + 0)
https://www.auchan.ru/brand/centrum/kancelyariya-dlya-tvorchestva/?promocodePopup=sentyabrsept2023&utm_medium=cpc&utm_source=yandex&utm_campaign=nonbrand_ven_General_p_msk%7C81118193&utm_term=---autotargeting&utm_content=k50id%7C0100000044543475659_44543475659%7Ccid%7C81118193%7Cgid%7C5095856444%7Caid%7C15066465673%7Cadp%7Cno%7Cpos%7Cother1%7Csrc%7Csearch_none%7Cdvc%7Cdesktop%7Cmain&k50id=0100000044543475659_44543475659&yclid=8161881911987535871;Канцелярские товары;;
https://yandex.ru/products/product/1778042091/sku/665104121?text=клей+карандаш+купить&rs=eJxNk81y2jAUhXedwnTVRd4i7b1XkiUtbcCAcUyww583DASwCcH8BGPgtfsCtUlTs9SMzpzznSPRn2_O7-oDpo1Bz-63h-Z2_9Y9-I_h3m2ZP6sopQJOZCBVJHGQACgKQX0R2wlm59bS7FrRZr54jV_dUgCCUYUznh-ZFs6v6sNoHFwd7c4C5VtyHgSG7VuX7EvAAIG-czAEaYmFQTfruOlyFqbBWakLtEyLp1lUJhL6M5HBSbBCoNKdNVx_7BbHJa4S0WCnVszuEukcwTAEAke6OYiwbXjYjK67q9Ofd9NtPfTM_4mISUkVzUnmSmHcBBuzM-wkGzXKgub7EfrQdtNe6SCBKoIIcw9iBXNkh6k8hK1VfE5fam_77XLdTaI7Zvpklio3gOoDh5p_9tX-sZWtHAd4vExTp2TmSlEVcx1XWsGNIV0r7zxNs7j3Hk2eJxNvTYd6dDcD3GbImQGgEBzGmd5Pzeyt7Uwn58PGPA2cRgld1FnhWmlSwKhgGBjZbLTm7kW9D7Z2XWUrtezf74Zfu6mbQTBSNH-a842XJOlTPKptOk9-WRLmNytKGhyNfzP0lu54a0Ot12u-6Is_ddDtBiUCgrjtpggRoWjJvk7rVjIOT4fMMzqW2fWaC1U68HzooiWmmeDIHaw-xAf20R_G1w7iaT0hDyjQx-hnRRsKhc6D0A8EZIxISlBUpBrVnrnXvowjcxOysd8wr3zXv_sQTOWpNGipOd6e33q-P5ltexcdkxm82sIaRke3xGCUv6Yc2yiWoL8P8N6s&lr=21621;Канцелярские товары;;клей карандаш купить
https://www.sima-land.ru/kley-karandash/;Канцелярские товары;;Купить клей-карандаш оптом и в розницу | Цена от 8.2 р в интернет-магазине Сима-ленд,Клей-карандаш
https://online.lenta.com/item/573307?utm_medium=cpc&utm_source=yandex&utm_campaign=DSA_gal_p_allregions%7C88443999&utm_term=&utm_content=k50id%7C010000004080434_4080434%7Ccid%7C88443999%7Cgid%7C5221850795%7Caid%7C14818828345%7Cadp%7Cno%7Cpos%7Cother3%7Csrc%7Csearch_none%7Cdvc%7Cdesktop%7Cmain&k50id=010000004080434_4080434&yclid=8709648408558174207;Канцелярские товары;;
https://ручки-оптом.рф/;Канцелярские товары;;Ручки Оптом - пластиковые, бумажные, металлические для гравировки и печати,Ручки Оптом Шариковые купитьЗаказать обратный звонок,Быстрый заказ
https://канцопт24.рф/collection/sharikovye-ruchki;Канцелярские товары;;Ручки шариковые оптом в разделе письменные принадлежности | От оптового поставщика канцелярии Канцопт24,Ручки шариковыеШариковые ручки оптовый каталог,Поставщик шариковых ручек в России
https://tver.110km.ru/vybor/kupit-s-probegom-poderzhannie-tver/;Авто;;Купить авто с пробегом от хозяина, продажа подержанных б/у автомобилей в Твери, цены - 866 объявлений,Продажа автомобилей с пробегом в Твери
https://tver.kupiprodai.ru/auto/tver_cars/;Авто;;Купить авто в Твери. Продажа новых, б/у, подержанных или с пробегом автомобилей в Твери на КупиПродай,Автомобили в Твери
https://tver.mbib.ru/used;Авто;;Продажа автомобилей с пробегом 🚗 в городе Твери: 4309 объявлений. Купить авто б/у, подержанный, с пробегом, цены.,Продажа подержанных автомобилей в городе Твери
https://ac-dubrovka.ru/?utm_source=yandex&utm_medium=cpl&utm_campaign=91628086&utm_content=5249516159&utm_term=---autotargeting&utm_type=tovarka&yclid=5332357252610260991;Авто;;Автосалон Дубровка в Москве - продажа авто с пробегом,Автосалон Дубровка в МосквеПоследние поступления,Подобрать автомобиль,О нашей компании,Банки-партнеры
https://китайские-автомобили.рус/cars/?utm_source=yandex&utm_medium=cpc&utm_campaign=China_Salon_SEARCH&utm_content=13128276695&utm_term=---autotargeting&yclid=17676563299388620799;Авто;;Китайские Автомобили Модельный Ряд и Цены [Купите сегодня со скидкой!],Подбор Китайского АвтомобиляНовые китайские автомобили в Москве у дилера,Онлайн заявка на автокредит во все банки,Обратный звонок,Бренды,Trade-In,Как купить новый автомобиль дешевле чем у дилера?Получить выгодное предложение!,CHANGAN CS85COUPE,LIXIANG L7,LIXIANG L8,Подбор,LIXIANG L9,CHANGAN CS95,CHANGAN EADOplus
https://second-cars.ru/cars/nissan/?utm_source=yandex&utm_medium=cpc&utm_campaign=Nissan_Tovar&utm_term=---autotargeting&utm_content=none&yclid=8769978235320008703;Авто;;Купить Ниссан с пробегом в Москве | Nissan БУ | Second Cars,Купить Nissan БУ в Москве:Найдено 132 автомобилей:,Марки,Модели:,Подобрать Б/У авто по параметрамNissan Micra,Nissan Almera,Nissan Note,Nissan Teana,Nissan Primera
https://market.yandex.ru/product--3d-printer-flyingbear-aone-2/1739659712?utm_term=9283442%7C1739659712&clid=1601&utm_source_service=web&utm_source=yandex&utm_medium=search&utm_campaign=ymp_offer_dp_komputer_feed_3_model_3_bko_dyb_search_rus&utm_content=cid%3A84222291%7Cgid%3A5283980082%7Caid%3A14999160769%7Cph%3A4537521%7Cpt%3Apremium%7Cpn%3A1%7Csrc%3Anone%7Cst%3Asearch%7Crid%3A4537521%7Ccgcid%3A20728017&adjust_t=fs3pybh&adjust_ya_click_id=7455898953121267711&referrer=reattribution%3D1&yclid=7455898953121267711&src_pof=1648&baobab_event_id=ln6gh7an1&wprid=1696103910893889-6912094391047467716-balancer-l7leveler-kubr-yp-vla-161-BAL-7268&icookie=d3ihxhZyI3N%2BVx24tsoZB5kK8lfkWDo6fJEikinOq8gF0orlRtSfIoAkTZw7Ny%2BCNkXzQFuqXfw9r0u92OZrM66OFO0%3D;Принтеры и МФУ;;Яндекс Маркет,3D принтер FlyingBear Aone 2Вы смотрели,Полезные ссылки,Часто ищут,Перейти к содержанию (Alt + 0),Где купить,Товар у продавца,Описание,Товар на Маркете,Еще может подойти3D принтер Phrozen Sonic Mini 8K,Прекрасный 3D принтер Geeetech Mizar TMC2208 тихие драйверы ( 220X220X260mm область печати),Высокотехнологичный 3D-принтер с сенсорным экраном,3D принтер Elegoo Saturn 2 8K,3D принтер Anycubic Kobra Neo,3D принтер FlyingBear Reborn 2,3D принтер Anycubic Photon Mono 2,Надежный 3D принтер Anycubic Photon Mono SE синий 2023,3D-принтер Flying Bear Ghost 5 черный,Sotcomp Omnivore 3D Printer White,Продавцам,3D принтер Flyingbear ghost 5,3D принтер Creality3D Ender 3,3D принтер Creality Ender-5 Plus 1001020037, размер печати 350x350x400mm,Коротко о товаре,3D-принтер FLSUN Super Racer,Портативный детский мини принтер (Mini Printer), электронная игрушка, карманный принтер для печати,Характеристики,3D принтер Artillery Hornet,3D принтер Creality Ender-5 S1,3D принтер Creality Halot Mage(1003040102),Сотрудничество,Фотополимерный LCD 3D Принтер Anycubic Photon Mono X 6KS (New 2023),FlashForge 3D принтер FlashForge Creator 3 Pro,3D принтер Anycubic Kobra 2 (набор для сборки),3D Принтер Kingroon KP3S Pro + 3 сопла (экструдер титан директ),3D-принтер Creality Ender 3 V2 черный,3D принтер Geeetech A10M (2023),3D Принтер FlyingBear Ghost 6,Фотополимерный LCD 3D Принтер Anycubic Photon Mono X 2.0 (New 2023),3D принтер Creality Ender-3 PRO, размер печати 220x220x250mm (набор для сборки),3D принтер Creality3D Ender 3 Neo (набор для сборки),Покупателям,3D принтер Creality Ender 2 pro, размер печати 165x165x180mm 1001020344,KINGROON KP3S 3D-принтер высокая точность печати DIY FDM,3D принтер Wanhao Duplicator D12-230
https://3dpt.ru/collection/3d-printer;Принтеры и МФУ;;Купить 3D-принтер в Москве – Сколько стоит 3D-принтер цена в России          ,3D-принтерыНа что обращать внимание при покупке 3D-принтераЧто следует искать в программном обеспечении и возможностях подключения для 3D-принтеров?,Итак, какой 3D-принтер мне купить?,Цену 3D-принтера определяет избранная группа функций,Каков правильный объем печати для 3D-принтера?,Явные отличия открытого и закрытого корпуса,На что следует обращать внимание при выборе используемых расходных материалов?
https://mygs.ru/catalog/3D_prints;Принтеры и МФУ;;3D-принтер купить по доступной цене | Москва - MyGadgetshop,3D ПринтерыОпишите, пожалуйста, ошибкуДля Стоматологии,Для Детей,3D принтер FLSUN V400,Для Ювелирного дела,3D принтер QIDI X-Plus II,3D Принтер Elegoo Mars 3,3D принтер Flashforge Adventurer 3 Pro 2,3D принтер Phrozen Sonic Mini 8K,О продукции,Помощь,3D принтер TEVO Nereus,С закрытым корпусом,3D принтер Bambu Lab P1S,3D Принтер Two Trees Bluer Plus,Для Прототипирования,3D принтер Anycubic Photon Mono 2 (4K+),3D принтер Flying Bear Reborn 2,3D принтер Artillery Genius,3D принтер Anycubic Photon mono X2 (4K+),3D принтер Raise3D Pro3 PLUS,3D принтер Anycubic Photon Mono 4K,Для больших объектов,3D принтер Creality3D K1 Max,Услуги,3D принтер Artillery Hornet,Магазин,3D-принтер (набор для сборки) Creality Ender 3 S1 Pro,3D принтер Creality3D CR-M4 (набор для сборки),Бюджетные,3D принтер Creality K1,Как выбрать 3D принтер?,Для чего нужен домашний 3D принтер?,Как выбрать 3д принтер?,3D-принтер (набор для сборки) Creality CR-M4,3D принтер Anycubic Kobra MAX,Для Образования,Для Кулинарии,3D принтер Anycubic Photon M3 Plus,3D принтер Elegoo Saturn 3 12k,3D принтер Anycubic Photon M3 Premium (8K),3D принтер Raise3D Pro3,3D принтер Anycubic Photon M3 MAX,Двухэкструдерные,3D принтер Flying Bear Ghost 6,3D принтер Elegoo Saturn 3 Ultra 12k,3D принтер Flashforge Adventurer 4,3D принтер Anycubic Photon Mono M5 (12K),3D принтер Elegoo Jupiter 6K,3D принтер Bambu Lab P1S Combo
https://www.originalam.net/all-in-one-ciss/epson/wf-2850-originalam.html?utm_source=yandex&utm_medium=cpc&utm_term=Принтер%20Для%20Офиса&utm_content=pu_ofis&utm_campaign=yndx_pu_msk&roistat=direct24_search_6756135722_Принтер%20Для%20Офиса&roistat_referrer=none&roistat_pos=other_2&yclid=540002917323374591;Принтеры и МФУ;;
https://beston.market/top/kompyuternaya-texnika/10-luchshih-printerov-dlja-nebolshogo-i-krupnogo-ofisa.html;Принтеры и МФУ;;10 лучших офисных принтеров в рейтинге 2021 года,10 лучших принтеров для небольшого и крупного офисаПринтеры для цветной печати,Как выбрать принтер для офиса,Принтеры для крупного офиса,Принтеры для небольшого офиса4. Pantum P2200,1. Xerox VersaLink B400DN,2. HP Neverstop Laser 1000w,3. Samsung ProXpress M4020ND,1. Brother HL-1223WR,3. Xerox Phaser 3020BI,2. KYOCERA ECOSYS P3145dn,2. Epson L1800,1. Ricoh SP C261DNw,4. Canon i-SENSYS LBP223dw
https://expertology.ru/luchshikh-mfu-dlya-ofisa/;Принтеры и МФУ;;12 лучших МФУ для офиса - Рейтинг 2023,12 лучших МФУ для офисаЛучшие цветные лазерные МФУ для офисов,Лучшие струйные МФУ для офиса,Лучшие черно-белые лазерные офисные МФУ,12 лучших МФУ для офисаEpson EcoTank L8160,Canon PIXMA G3411,Pantum M6507,Canon i-SENSYS MF445dw,Pantum CM1100ADW,Brother DCP-L8410CDW,HP OfficeJet Pro 9010,Xerox WorkCentre 3025BI,HP Color LaserJet Pro M283fdw,Brother DCP-L2520DWR,HP LaserJet Pro MFP M428fdw,KYOCERA ECOSYS M5526cdw
https://auto.ru/;Авто;;302 Found,302 Found
https://auto.ru/cars/used/;Авто;;302 Found,302 Found
https://auto.drom.ru/;Авто;;Продажа автомобилей в России. Подержанные авто, новые. Купить автомобиль б/у, цены.,Дром Авто - Продажа автомобилей
https://m.avito.ru/all/avtomobili;Авто;;
https://auto.ria.com/;Авто;;302 Found,302 Found
https://www.autonews.ru/;Авто;;Автоновости на Autonews.ru: всё о машинах и авторынке,
https://autospot.ru/;Авто;;Автоспот ру: купить новые автомобили в Москве, цены на продажу авто на Autospot,Быстро выбрать и выгодно купить авто от официального дилераЛучшие предложения,Пройти ТО со скидкой,Наши партнеры — официальные дилеры,Марки новых автоИнтересно,Geely Atlas Pro,Geely Новый Tugella,Москвич 3,Chery Tiggo 7 Pro Max,Chery Tiggo 4 Pro
https://av.by/;Авто;;av.by — купить, продать авто в Беларуси. Автомобили новые и с пробегом на Автомалиновке.,65 731 объявление о продаже авто в Беларуси«Зачем мне быть председателем?» Расспросили водителя Fendt IDEAL 9 о преимуществах немецкого комбайна,Горячее предложение от «ПарадАвто»: лёгкие коммерческие автомобили Dongfeng с полной массой до 3,5 т уже в Минске! Лизинг — 0% в BYN,Транспортная инспекция продолжает изымать такси. Что будет за неподчинение?,Электрический кроссовер Voyah Free с запасом хода 960 км всего под 7,9% годовых. Как приобрести?,Раскрыта цена большого кроссовера Kia EV9,Skoda впервые показала «второй» Kodiaq без камуфляжа,Авторазборка в Могилёве: «Цена на хороший мотор из Европы — $1 400, АКПП — 300—400 рублей»,Техника с полей. Fendt 1050 —мощнее трактора в классической компоновке во всём мире нет!*,В минском автоцентре «ДрайвМоторс» устроили распродажу «бэушек». Цены рухнули,Конфликт на СТО: «Minsk D4 125 сломали, а нас — избили». Мастер: «Никогда ремонтом не занимались»,На выходных ГАИ усилит контроль. Минщину будут патрулировать экипажи ДПС из соседних районов,И Geely, и BELGEE. Узнали, какие кроссоверы в наличии у дилеров в сентябре,Voyah Free с запасом хода 960 км. Импортёр рассказал, что нужно знать о новой версии кроссовера,Посмотрите, как собирают в Китае пикапы JAC T6 для Беларуси,Самые распространённые мифы о моторном масле. Мнение экспертов,Две «Тойоты» за $30 тысяч ввозили в Беларусь. Цена оказалась неверной,Ещё у нас есть,«Готовы ездить за копейки». Поговорили с белорусом, открывшим бизнес по грузоперевозкам в Польше,Первый в мире летающий автомобиль показали вживую. Его можно заказать за $150,Свежие новости,Geely Geometry E. Первый белорусский обзор самого маленького электрокара «Джили»,Уже 200. На границе с Польшей за сутки сильно выросло число легковушек,«Кабину за день могу раз двадцать продуть!» Пообщались с водителем очень большого «КИРОВЦА К-742М»,Минчанка отдала Opel в ремонт. В следующий раз увидела авто на штрафстоянке,Geely показала гибридный седан Preface за $19 000. Его могли собирать в Беларуси,Новый Renault Clio разработают с участием Geely: первые изображения,Оплатить дезинфекцию на границе станет можно с помощью электронной марки,BMW показала седан 5-й серии с расходом топлива до 1 л на 100 км,30 сентября в Минске состоится BMW FEST,Hyundai и Kia проводят рекордный отзыв из-за риска возгорания. Список опасных моделей,Audi более чем за $100 тысяч въезжала в Беларусь из Польши, но границу пересечь не смогла,Обзоры автомобилей,Минтранс о ремонте дорог: сколько средств выделено, что сделано и с кем хотят сотрудничать,«Покупал за $2 200, но для меня — цены ему нет!» Белорус приобрёл редкий скутер BMW C1,Автожурнал,Финальный этап Race Wars 2023 пройдёт в «Стайках» 1 октября,Лимиты беспошлинного ввоза товаров в Беларусь останутся прежними ещё полгода,Крути педали! Белорус купил в Голландии веломобиль и вернулся на нём в Беларусь, проехав 1 600 км,Интересное за сегодня,Универсал Lada Vesta получит псевдоспортивную версию. Первые фото,У BMW X6 и Mercedes-Benz GLE появился новый корейский соперник,Минивэн Volvo в стиле Geely показали на новых фото,Volkswagen начал устанавливать на преемника Passat кресла, которые помогут вылечить спину,Промыть, просушить и промазать! Вместе со специалистом отправляем мотоцикл на зимовку,Новые авто,Сервисы,«Багажник как у „Пассата“». Минчанин о плюсах и минусах Toyota Auris Touring Sports,Приехал из Аляски! Посмотрите, как белорус восстановил редкий BMW R60/2 1968 г.в.,Новости компанийLada Vesta,Kia Sorento,Кредит и лизинг,Chery Tiggo 4 Pro,Hyundai Santa Fe CM · Рестайлинг,Audi Q3 F3,Mercedes-Benz GLC X253,Jeep Wrangler,Haval F7,Subaru XV,Симулятор перекупа,Проверка истории транспорта по VIN,Volvo XC90 II,Audi S4 B9 · Рестайлинг,Mercedes-Benz E-Класс W213, S213, C238, A238,Электро­мобили,Три правила успешной продажи авто,Jeep Compass II,Оценка стоимости авто
https://auto.mail.ru/;Авто;;Авто Mail.ru: тест-драйвы, новости авторынка, авто-обзоры,
https://www.copart.com/ru;Авто;;
https://cena-auto.ru/;Авто;;Цены на новые автомобили в России. Купить или обменять машину | Цена Авто,Статьи,Поменять автомобиль,Выберите марку,Новые автомобили в автосалонах 5383,Официальные дилеры 5080,Новые автомобили в наличии у официальных дилеров по всей России,Купить автомобиль,ТОП-10 продаж в России по рейтингу Автостата,Новинки авторынка«АВТОДОМ» начал продажи автомобилей LiXiang,«У Сервис+» расширил портфель брендов,ТОП-10 марок по количеству дилеров в России,АВТОВАЗ запускает акцию по обслуживанию автомобилей LADA Granta,ТОП-10 регионов РФ по числу автодилеров,ТОП-10 регионов России по количеству АЗС,ГК «БорисХоф» привезет в Россию электромобили HiPhi,Игорь Моржаретто: Kia Cerato – первый в теле,В декабре автомобили LADA доступны по скидкам,Тест-Драйв 7D: Hyundai Creta,Игорь Моржаретто: Isuzu Mu-X – настоящий мужик,В России появился седан MG 5 по цене от 2,35 млн рублей,В Санкт-Петербурге открылся флагманский автосалон JAECOO,Программа выгодного техобслуживания стала доступной для всех моделей LADA
