link; label;Unnamed: 2;metadata
https://rocket-market.ru/catalog/foto_video_i_audiotekhnika/;Фото, видео и аудиотехника;;Фото, видео и аудиотехника от Рокет Маркет,
https://www.mvideo.ru/audiotehnika;Фото, видео и аудиотехника;;
https://www.mvideo.ru/audiotehnika-i-dj-oborudovanie-9;Фото, видео и аудиотехника;;
https://future-phone.ru/catalog/televizory_audio_video_foto;Фото, видео и аудиотехника;;Купить Аудио-видео, фото цены в Пензе, Нижнем Новгороде, Москве,Аудио-видео, фото
https://www.kombik.com/catalog/view/audio-technica-atw1702/;Фото, видео и аудиотехника;;Audio-Technica ATW1702 радиосистема для фото/видео камеры купить в Москве в интернет-магазине Kombik,Audio-Technica ATW1702 радиосистема для фото/видео камерыПосмотрите похожие товары,Отзывы о Audio-Technica ATW1702
https://www.fotosklad.ru/;Фото, видео и аудиотехника;;Интернет магазин фототехники. Продажа фотоаппаратов, фототоваров, оптики, цифровой техники - Фотосклад.ру,Фотосклад — больше чем фотомагазинНовинки,Новости компании,Хиты продаж,Смартфоны с NFC,Canon,Raylab,Бренды,Смартфоны на Android,Выгодные акции,Профессиональные беззеркальные фотоаппараты,Смартфоны Huawei с 2 Sim-картами
https://foto-market.ru/;Фото, видео и аудиотехника;;Магазин,ИНТЕРНЕТ-МАГАЗИН ЦИФРОВОЙ ФОТОТЕХНИКИ, БЫТОВОЙ И КОМПЬЮТЕРНОЙ ТЕХНИКИ FOTO-MARKET.RU
https://igadget16.ru/audio-equipment;Фото, видео и аудиотехника;;Аудиотехника — купить онлайн в интернет магазине iGadget,АудиотехникаНаушники и гарнитуры,Музыкальный инструмент,Усилители и AV-ресиверы
https://kvin-tur.ru/tury-za-granitsu/;Зарубежный туризм;;Горящие туры за границу - цены на путевки от «Квин-Тур»,Отдых за границейПодписка оформлена,Сообщение отправлено,Закажите звонок,Горящие туры для двоих,Оставьте заявку на тур,Что нужно?,Оставьте заявку,Горячие туры без визыВы подписались на рассылку!
https://www.pegast-agent.ru/otdyh-za-granicej/;Зарубежный туризм;;Отдых за границей,Отдых за границей
https://magput.ru/tours/ekskursionnye-tury-za-granitsu;Зарубежный туризм;;Экскурсионные туры за границу,Экскурсионные туры за границуМНОГОДНЕВНЫЕ ЭКСКУРСИОННЫЕ ТУРЫ ЗА ГРАНИЦУ,Заявка на подбор тура отправлена
https://www.1001tur.ru/hot/;Зарубежный туризм;;Горящие туры из Москвы 2023 - 2024 от всех туроператоров 🔥 Официальный сайт банка горячих путёвок: цена онлайн от 1792 руб.,ГОРЯЩИЕ ТУРЫ 2023 ОТ ВСЕХ ТУРОПЕРАТОРОВГорящие туры в популярные курорты,Что такое горящий тур?,Пользователи часто ищут,Горящие туры из Москвы и других городов России.,Каждый найдет свой отдых,Популярные города вылета,Будьте в курсе,Преимущества покупки горящих туров у 1001 тура,Популярные отели,Найдите горящие туры в 228 странМы в соц сетях
https://travelata.ru/tury;Зарубежный туризм;;Горящие туры из Москвы от всех туроператоров 2023 🔥 — купить, поиск горячих путевок онлайн,Горящие туры из Москвы 2023Поиск горящих путевок 2023Туроператоры
https://level.travel/;Зарубежный туризм;;Level.Travel | Поиск туров по всем туроператорам онлайн, купить горящие туры с вылетом из России, подбор тура,
https://www.aborigen-tour.ru/book/region-tour/;Зарубежный туризм;;АБОРИГЕН-ТУР :: Туры за границу: Турция, Египет, Испания, Тайланд, Вьетнам, Греция, Индия, Индонезия, Испания, Китай, ОАЭ, Чехия, Болгария,Туры за границу
https://tancy.pro/;Танцы;;Школа танцев в Москве, студия танцев PROТАНЦЫ официальный сайт,Школа танцев в Москве PROТАНЦЫСтудия современного танца,Почему мы?
https://danco-studio.ru/course_adult/;Танцы;;
https://9zalov.ru/;Танцы;;Школа танцев - 9 залов Москва,ТвойГород танцевЧасто задаваемые вопросыРядом с метро,Работаем с 2009 года,Огромный выбор направлений
https://trix-family.ru/zanjatija-tancami;Танцы;;Занятия танцами в Москве: школа танцев Trix-Family,Занятия танцамиГде можно заниматься танцами в Москве?Занятия танцами в Москве: 3 факта о Trix-Family,Занятия танцами в Москве: начните прямо сейчас
https://www.galladance.com/directions/grown-up/sovremennye-tantsy/;Танцы;;Современные танцы для взрослых - обучение, занятия в Москве - Школа танцев GallaDance,Современные танцы
https://danceschools.ru/frunzenskij-rajon.htm;Танцы;;Школы танцев во Фрунзенском районе Санкт-Петербурга,Школы танцев во Фрунзенском районеОбучение танцам – советы начинающим танцорам,Танец на пилоне для начинающих — что нужно знать?,Как выбрать школу танцев?,Бальные танцы — описание и виды танцевальных программ
https://vk.com/platforma29;Танцы;;Платформа | танцы в Архангельске | VK,Платформа | танцы в Архангельске | VKПлатформа | танцы в АрхангельскеProductenAdressenVideoFotoClipsDiscussiesBestandenSujetten,Alle notitiesNotities van de groep ZoekenAnnuleren
https://m-food.ru/;Доставка готовых блюд и продуктов;;Готовое питание с доставкой на дом в Москве - вкусная домашняя еда на заказ,Доставка готовой еды My FoodMy Food – это вкусно, модно и разнообразно,Выгодно ли это? Давайте проведем эксперимент!,Готовим и доставляем еду на целый день,3 блюда за 330 ₽ в день,Отзывы,Три меню на выбор,Частые вопросы,Три меню на выбор:Что, если я не смог принять курьера?,Сколько стоит доставка?,Сколько дней заморозки у меня есть?,Где мы готовим?,Когда первая доставка?,Как доставляете?,Могу сократить диапазон доставки?,9 900 ₽,Подпишитесь на нас в соцсетях,Можно пропустить день доставки?
https://elementaree.ru/;Доставка готовых блюд и продуктов;;Доставка продуктов с рецептами на дом | Свежие наборы продуктов на неделю | Elementaree,Продукты с рецептами на домПодборки блюд,Наше меню,Мы всё подготовили.Чтобы вы приготовили,Мы всё подготовили!
https://journal.tinkoff.ru/list/food-delivery/;Доставка готовых блюд и продуктов;;Готовая еда с доставкой на дом в 2023 году: обзор сервисов в Москве,Где заказать готовую еду: 14 сервисов доставки на домВнук и внучка,Grindin,Dellos Delivery Diet,Just for you,Grow Food и «Прием!»,BeFit,Performance Food,Fresh Lab,Level Kitchen,Smart Calories,Популярное за неделю,JustFood,Solo Food,Вот что еще мы писали по этой теме,YamDiet,ВкусМил,Сообщество
https://edadeal.ru/journal/230329-the-best-ready-to-eat-food-deliveries-for-the-week/;Доставка готовых блюд и продуктов;;Топ-16 лучших сервисов доставки готовой еды на неделю в 2023 году — Журнал Едадила,Топ-16 лучших сервисов доставки готовой еды на неделю в 2023 годуСодержание,Здоровое питание для похудения: топ-7 лучших доставок готовой еды на неделю,На что обратить внимание при выборе сервиса,Преимущества и недостатки заказа готовой еды,Список сервисов здорового питания для спортсменов: что они предлагают,Как выбрать хорошее манго: учимся определять спелость по внешнему виду,Лучшие доставки готовой домашней еды,Как правильно выбрать спелый ананасMy food,«Внук и внучка»,Crosspack,justfood
https://www.nam-nyam.ru/blog/vybrat-edu-na-den/;Доставка готовых блюд и продуктов;;"Доставка еды на день, меню готовых блюд,Как выбрать еду на день?Забота о здоровье каждый день,Как заказать готовую еду на день?,Готовая еда для детей на день, как у бабушки,Завтраки, обеды и ужины для любой ситуации.,Преимущества готовой еды на каждый день от  ""Нам-Ням""Как выбрать еду на день?,скачать меню (.xls)"
https://www.google.com/url?sa=t&rct=j&q=&esrc=s&source=web&cd=&cad=rja&uact=8&ved=2ahUKEwjB_8jRg9OBAxWFUXcKHRxRAyk4FBAWegQIBBAB&url=https%3A%2F%2Fkakvkusno.ru%2F&usg=AOvVaw3_01OPenux_KZNw611WlK6&opi=89978449;Доставка готовых блюд и продуктов;;
https://waterstation.ru/;Доставка воды;;АкваЭкспресс - служба доставки воды в Подмосковье: Коломна, Егорьевск и Воскресенск,,АкваЭкспресс - служба доставки водыПреимущества нашей компании как поставщика питьевой воды:
https://www.akva-mir.ru/catalog/kulery;Доставка воды;;
https://msk.yp.ru/detail/id/akvaekspress_g_kolomna_4300019/;Доставка воды;;Акваэкспресс г. Коломна, Московская область, Коломна, улица Октябрьской Революции, дом 429-б — Вода питьевая - производство, продажа, доставка,Акваэкспресс г. КоломнаАЛАНКОЛ,Отзывы о компании Акваэкспресс г. Коломна,Спецпредложения,Похожие компании,Позиция компании,АКВАЭКСПРЕСС, торговая компания,Акваэль,АЛЕКСАНДРОВ КЛЮЧ
https://delan.ru/?prmn_fias=4929;Доставка воды;;Доставка воды в Архангельске, Архангельской области: Покупки стали проще —  компания Делан,Доставка питьевой воды в Архангельске, Архангельской обл.Вы смотрели,Кофе,Кулеры для воды и аксессуарыЗабыть пароль?,Авторизация,Зарегистрироваться
https://vodasnezhok.app11.ru/;Доставка воды;;Вода Снежок | Доставка воды в Архангельске ,Закажи воду с доставкойв городе Архангельск,Скачайте приложение сейчас и заказывайте удобно!Доставка
https://водаводолей.рф/;Доставка воды;;Доставка воды на дом, офис, школу. Балашиха, Железнодорожный, Люберцы, Реутов,Доставка воды от вквНаши преимущества,Доставка воды,У нас есть сертификаты на всю нашу продукцию!С нашей водой Вы сохраните свое здоровье, а ваша жизнь станет намного чище!,Что можно сказать о качестве водопроводной воды?,Воду необходимо употреблять в определенное время:
https://market-delivery.yandex.ru/retail/komus/product/d3215f09-bf27-443b-b110-9ab9640d565e;Канцелярские товары;;
https://market.yandex.ru/product--brauberg-korrektiruiushchaia-zhidkost-classic-s-kistochkoi-20-ml-220255/745063379;Канцелярские товары;;"Яндекс Маркет,BRAUBERG Корректирующая жидкость Classic с кисточкой, 20 мл, 220255Вы смотрели,Полезные ссылки,Часто ищут,Перейти к содержанию (Alt + 0),Где купить,Описание,Отзывов ещё нет — ваш может стать первым,Еще может подойтиКорректирующая жидкость OfficeSpace Optimum, 15мл, на химической основе, с кистью (Cvr_24776),Корректирующая жидкость OfficeSpace, 20мл, на химической основе, с кистью (CF20_67077),Корректирующая жидкость гамма ""Штрих"", с кисточкой, 20 мл, 341002,116 ₽,Корректирующая жидкость BRAUBERG ""Aqua"" на водной основе 20 мл, с кисточкой, 228643,Корректирующая жидкость Berlingo, 20мл,(27г) водная, с кистью (арт. 309643),Гамма Корректор Штрих с кисточкой, 27 г,Корректирующая жидкость BRAUBERG на водной основе, 20 мл, с кисточкой, 221270,Корректирующая лента/корректор/шрих/замазка Brauberg, 5 мм х 6 м, корпус красный, с подкручиванием, блистер, 226809,ErichKrause Корректирующая жидкость с кисточкой 20 мл белый,Корректирующая жидкость STAFF ""EVERYDAY"" быстросохнущая, 20 мл, с кисточкой, 228625,Корректирующая жидкость Brauberg ""Premium"", 20 мл, с губкой, быстросохнущая, ярко-белая (224090),Продавцам,Разбавитель для корректирующей жидкости Brauberg 20 мл (220617),89 ₽,Коротко о товаре,Корректирующая жидкость, 20 мл, водная Berlingo, с кистью,Корректирующая жидкость OfficeSpace, 12мл, на химической основе, с кисточкой (CFS20_1876),66 ₽,Корректор жидкость 20мл спирт. осн. с губкой ERICH KRAUSE 13812,Характеристики,Корректирующая жидкость Staff 15 мл, с кисточкой, быстросохнущая (226055),Корректирующая жидкость OfficeSpace, 12 мл, упаковка 12 шт.,Ручка-корректор BRAUBERG ""Standard"", 7 мл, металлический наконечник, в упаковке с подвесом, 222058,Attache Корректирующая жидкость быстросохнущая (702955),70 ₽,Корректирующая жидкость Erich Krause ""Arctic White"" 20 мл, экстра белизна, флакон с кисточкой (6),Корректирующий набор BRAUBERG, корректирующая жидкость + разбавитель, 20+20 мл, 220454,Сотрудничество,Корректирующая ручка Attache 3мл, белый корпус Россия,71 ₽,Корректирующая жидкость Berlingo, 20мл, на химической основе, с кистью (арт. 255110),Корректирующая лента/корректор/шрих/замазка Brauberg 5 мм х 8 м, корпус синий, механизм перемотки, блистер, 227801,Коррект. ручка Brauberg 10мл с мет. након. (220618),Покупателям,Корректирующая лента 30 метров ""deVENTE"" / Штрих / Корректор текста 5 мм. x 30 м. с боковым аппликатором / Лента-роллер / Замазка для текста,Корректирующая жидкость Attache 12 г, Economy, быстросохнущая основа, кисточка (1085902),Корректирующая жидкость BRAUBERG ""Premium"" быстросохнущая, 20 мл, с губчатым аппликатором, 224090,77 ₽,Корректирующая жидкость юнландия быстросохнущая, 20 мл, с кисточкой, 228431,Корректирующая жидкость ERICH KRAUSE, 20 мл, флакон с кисточкой, 5,Корректирующая жидкость Attache, 20мл, на водной основе"
https://market-delivery.yandex.ru/retail/komus/product/05b4256e-f2dc-41cb-aa54-7eecc9158b47;Канцелярские товары;;
https://leonardo.ru/ishop/tree_9538925450/;Канцелярские товары;;
https://www.wildberries.ru/brands/lihit-lab/penaly;Канцелярские товары;;Покупателям,Подтвердите свой возраст,Партнерам,Компания,Мы в соцсетях,Приложение Wildberries,Наши проекты
https://my-shop.ru/shop/product/4970712.html;Канцелярские товары;;Пенал школьный Урбан - купить с доставкой | Майшоп,Пенал школьный УрбанДарим бонусы за отзывы!,Идут в комплекте,Вопросы,Отзывы,Характеристики,Описание
https://on.pleer.ru/product_951390_Brauberg_Dandelions_271032.html;Канцелярские товары;;Купить Brauberg Dandelions 271032 по низкой цене в Москве - Интернет магазин Плеер.ру,
https://www.lamborghini-avtodom.ru/;Авто;;АО Автодом - официальный дилер Lamborghini(Ламборгини) в Москве,Модельный рядLamborghini,Узнайте большео суперкарах Lamborghini,О компании,Спасибо!,События LamborghiniLamborghini представляет вам новую модель - Huracán Sterrato,Аукцион первого NFT Lamborghini открыт,Lamborghini представил первый электрокар Lanzador,Оставить заявку,Lamborghini АВТОДОМ стал партнером Unlim Fest,Lamborghini представляет юбилейные версии Huracan,Lamborghini представил Revuelto
https://spb.lamborghini-avtodom.ru/news/aukcion-pervogo-nft-lamborghini-otkryt/;Авто;;Аукцион первого NFT Lamborghini открыт,Аукцион первого NFT Lamborghini открытСпасибо!События
https://moscow.110km.ru/prodazha/lamborghini/;Авто;;Купить Ламборджини в Москве: продажа Lamborghini новых и с пробегом в Мск - 150 объявлений,Продажа Ламборджини в Москве
https://porsche-dealer.ru/;Авто;;Официальный дилер Porsche - Порше Центр Ленинский,Заголовок
https://www.ileasing.ru/catalog/car/kupe/porsche_911_carrera_4s_kupe/;Авто;;Porsche 911 Carrera 4S 450 л.с., бензин в лизинг для юридических лиц,Porsche 911 Carrera 4S
https://vk.com/bkbaraxolkamsk;Авто;;"Барахолка ""ЖИГУЛЕЙ"" МОСКВА | VK,Барахолка ""ЖИГУЛЕЙ"" МОСКВА | VKБарахолка ""ЖИГУЛЕЙ"" МОСКВАDiscussiesArtikelsClipsVideoFoto,Notities van de groepVK Donut ZoekenAnnuleren"
https://www.avito.ru/elektrogorsk/orgtehnika_i_rashodniki/printery-ASgBAgICAUSoAoQK;Принтеры и МФУ;;Купить принтер 🖨 в Электрогорске с доставкой: лазерный, струйный, матричный | Недорогая электроника | Авито,Продажа принтеров в ЭлектрогорскеПринтер Robotron K 6312 M,Принтер фото Canon Pixma iP4700,Цветной лазерный принтер,Принтер HP,Принтер Epson L805,Мини принтер Canon Zoemini,Canon i-sensys lbp 2900b,Термопринтер этикеток,Принтер трансферный тату,Термальный принтер Xprinter xp 365b,Принтер Canon,Оригинальный экструдер Flying Bear Ghost 6,Принтер на запчасти,Цветной струйный принтер hp,Плата Epson L312 L110,Лазерный принтер xerox, двусторонний (дуплекс),Ккт штрих-М-02Ф,Принтер струйный Canon pixma G1411,Принтеры на запчасти,Принтер HP 7110. (А3, А4),Принтер чековый Атол rp-326 -use,Принтер hp laserjet1100,Цветной принтер картридж, модель HP CB607A,Принтер лазерный б/у,Принтер HP Lazerjet P4015n,Вакуумный 3d термопресс,Текстильный DTF принтер Erasmart A3 1390,Xprinter xp 365B (термоэтикетки в подарок),Уф принтер Erasmart A3 1390 UV,Принтер лазерный,Принтер LaserJet Pro P1102w,Портативный мини принтер,Цветной струйный принтер,Продам термопринтер XP 365B,Принтер epson L800,Лазерный принтер canon,Новый термопринтер xprinter 365b,Принтер canon LBP 6020B,Принтер Canon ip4700,Новый лазерный принтер,Принтер xerox phaser 3320 (wi-fi),Шаговый двигатель Nema 23 (76mm),Загрузите приложение Авито,Принтер,Лазерный Цветной Принтер Samsung CLP 300,Epson L110 по запчастям,Печатная головка для Flying Bear Ghost 5 (0,4 ),Портативный принтер canon,Пищевой принтер canon,HP LJ Pro 400 M401a,Мини принтер,Принтер hp laserjet p1566,Принтер Canon IP4600
https://yandex.ru/products/product/1777955465/sku/779068040;Принтеры и МФУ;;
https://electrogorsk.compbu.ru/periphery/printers/laser-printers/cherno-belye-lazernye-printery/;Принтеры и МФУ;;[SSL: CERTIFICATE_VERIFY_FAILED] certificate verify failed: Hostname mismatch, certificate is not valid for 'electrogorsk.compbu.ru'. (_ssl.c:997)
https://electrogorsk.compbu.ru/periphery/printers/laser-printers/cherno-belye-lazernye-printery/defective/;Принтеры и МФУ;;Товары с недостатками: Черно-белые лазерные принтеры Б/У в Электрогорске, купить черно-белые лазерные принтеры БУ с дефектами (Электрогорск).,ИНТЕРНЕТ-МАГАЗИН Б/У КОМПЬЮТЕРНОЙ И БЫТОВОЙ ТЕХНИКИ И ЭЛЕКТРОНИКИ,Черно-белые лазерные принтерыПродажа БУ системных блоков компьютеров, ЖК (TFT) мониторов и компьютерных комплектующих
